{
  "schemaVersion": 1,
  "id": "builtin-general-knowledge",
  "title": "General Knowledge",
  "description": "A small non-maths sheet showing that any short-answer topic works.",
  "builtin": true,
  "enabled": false,
  "questions": [
    {
      "question": "What planet is known as the Red Planet?",
      "answer": "Mars"
    },
    {
      "question": "What HTTP status code means Not Found?",
      "answer": 404
    },
    {
      "question": "What CSS property changes text color?",
      "answer": "color"
    },
    {
      "question": "What is the capital city of Japan?",
      "answer": "Tokyo"
    }
  ]
}
