{
  "schemaVersion": 1,
  "id": "builtin-calculus",
  "title": "Calculus",
  "description": "Derivatives and simple definite integrals.",
  "builtin": true,
  "enabled": true,
  "questions": [
    {
      "question": "If f(x)=4x^3, what is f'(1)?",
      "answer": 12
    },
    {
      "question": "Compute integral from 0 to 1 of x^2 dx. Answer as a fraction or decimal.",
      "answer": "1/3",
      "tolerance": 0.005
    },
    {
      "question": "For f(x)=e^(5x), what is f'(0)?",
      "answer": 5
    },
    {
      "question": "If f(x)=7x^2, what is f'(3)?",
      "answer": 42
    },
    {
      "question": "Compute integral from 0 to 1 of x^4 dx. Answer as a fraction or decimal.",
      "answer": "1/5",
      "tolerance": 0.005
    }
  ]
}
