{
  "schemaVersion": 1,
  "id": "builtin-linear-algebra",
  "title": "Linear Algebra",
  "description": "Determinants, dot products, and eigenvalues.",
  "builtin": true,
  "enabled": true,
  "questions": [
    {
      "question": "Find det([[2, 3], [1, 4]]).",
      "answer": 5
    },
    {
      "question": "Compute the dot product (3, -2) dot (4, 5).",
      "answer": 2
    },
    {
      "question": "For triangular matrix [[6, -1], [0, 2]], one eigenvalue is 6. What is the other eigenvalue?",
      "answer": 2
    },
    {
      "question": "Find det([[1, -5], [2, 3]]).",
      "answer": 13
    },
    {
      "question": "Compute the dot product (-4, 3) dot (2, -6).",
      "answer": -26
    }
  ]
}
