{
  "schemaVersion": 1,
  "id": "builtin-ai-maths",
  "title": "AI Maths",
  "description": "Losses, gradients, and model probabilities.",
  "builtin": true,
  "enabled": true,
  "questions": [
    {
      "question": "Binary cross-entropy for y=1, p=0.5. Give the answer to 2 decimals.",
      "answer": 0.69,
      "tolerance": 0.015
    },
    {
      "question": "For logits [0, 0], what is the softmax probability of the first logit? Give the answer to 2 decimals.",
      "answer": 0.5,
      "tolerance": 0.015
    },
    {
      "question": "For squared loss L=(y_hat-y)^2 with y_hat=4 and y=1, what is dL/dy_hat?",
      "answer": 6
    },
    {
      "question": "Binary cross-entropy for y=0, p=0.2. Give the answer to 2 decimals.",
      "answer": 0.22,
      "tolerance": 0.015
    },
    {
      "question": "For squared loss L=(y_hat-y)^2 with y_hat=-2 and y=3, what is dL/dy_hat?",
      "answer": -10
    }
  ]
}
